{
  "arms": [
    {
      "arm_id": "baseline",
      "config": {
        "context_token_budget": 48,
        "judge": "deterministic-evaluator-v1",
        "reader": "deterministic-required-evidence-reader-v1",
        "retrieval_mode": "fused-replay-v1",
        "scan_budget": 12,
        "seed": 1136,
        "top_k": 3
      },
      "metrics": {
        "answer_outcomes": {
          "abstained": 0,
          "denominator": 5,
          "insufficient_evidence": 1,
          "supported": 4
        },
        "context_assembly": {
          "assembly_error_count": 0,
          "delivered_tokens": 180,
          "denominator": 5,
          "selected_count": 15
        },
        "execution": {
          "answerer_calls": 0,
          "case_denominator": 5,
          "judge_calls": 0,
          "provider_calls": 0
        },
        "retrieval_sufficiency": {
          "denominator": 7,
          "required_evidence_rate": 0.857143,
          "selected_required_count": 6
        }
      }
    },
    {
      "arm_id": "matched-size-control",
      "config": {
        "context_token_budget": 48,
        "judge": "deterministic-evaluator-v1",
        "reader": "deterministic-required-evidence-reader-v1",
        "retrieval_mode": "fused-replay-v1",
        "scan_budget": 12,
        "seed": 1136,
        "top_k": 3
      },
      "metrics": {
        "answer_outcomes": {
          "abstained": 0,
          "denominator": 5,
          "insufficient_evidence": 1,
          "supported": 4
        },
        "context_assembly": {
          "assembly_error_count": 0,
          "delivered_tokens": 180,
          "denominator": 5,
          "selected_count": 15
        },
        "execution": {
          "answerer_calls": 0,
          "case_denominator": 5,
          "judge_calls": 0,
          "provider_calls": 0
        },
        "retrieval_sufficiency": {
          "denominator": 7,
          "required_evidence_rate": 0.857143,
          "selected_required_count": 6
        }
      }
    },
    {
      "arm_id": "random-control",
      "config": {
        "context_token_budget": 48,
        "judge": "deterministic-evaluator-v1",
        "reader": "deterministic-required-evidence-reader-v1",
        "retrieval_mode": "fused-replay-v1",
        "scan_budget": 12,
        "seed": 1136,
        "top_k": 3
      },
      "metrics": {
        "answer_outcomes": {
          "abstained": 0,
          "denominator": 5,
          "insufficient_evidence": 2,
          "supported": 3
        },
        "context_assembly": {
          "assembly_error_count": 0,
          "delivered_tokens": 180,
          "denominator": 5,
          "selected_count": 15
        },
        "execution": {
          "answerer_calls": 0,
          "case_denominator": 5,
          "judge_calls": 0,
          "provider_calls": 0
        },
        "retrieval_sufficiency": {
          "denominator": 7,
          "required_evidence_rate": 0.714286,
          "selected_required_count": 5
        }
      }
    },
    {
      "arm_id": "receipt-blocked",
      "config": {
        "context_token_budget": 48,
        "judge": "deterministic-evaluator-v1",
        "reader": "deterministic-required-evidence-reader-v1",
        "retrieval_mode": "fused-replay-v1",
        "scan_budget": 12,
        "seed": 1136,
        "top_k": 3
      },
      "metrics": {
        "answer_outcomes": {
          "abstained": 4,
          "denominator": 5,
          "insufficient_evidence": 1,
          "supported": 0
        },
        "context_assembly": {
          "assembly_error_count": 0,
          "delivered_tokens": 180,
          "denominator": 5,
          "selected_count": 15
        },
        "execution": {
          "answerer_calls": 0,
          "case_denominator": 5,
          "judge_calls": 0,
          "provider_calls": 0
        },
        "retrieval_sufficiency": {
          "denominator": 7,
          "required_evidence_rate": 0.142857,
          "selected_required_count": 1
        }
      }
    }
  ],
  "benchmark": "receipt-conditioned-trace-faithfulness",
  "cases": [
    {
      "baseline_receipt": {
        "agent_id": "agent-a",
        "as_of_unix_ms": 1787616000000,
        "baseline_selection_sha256": "2ccbcfb31f3a024deeaeb1319fb2bf550580441b2713edb2a1cdc4342e80729c",
        "case_id": "cache-fallback",
        "config_sha256": "835b662a6dd58282da6610f6a19c334951ecf1e3e818eb8b5aa12026c552e5f7",
        "receipt_candidate_ids": [
          "ev-cache-base"
        ],
        "receipt_sha256": "6aa79f715f98fafb2f115562d7bae328c092dcd3998437faec6123f7c83fdf77",
        "receipt_source_groups": [
          "g-cache"
        ],
        "receipt_source_refs": [
          "ref-cache-base"
        ],
        "schema_version": "perseus-vault-evidence-intervention-receipt/v1",
        "sealed_before_intervention": true,
        "workspace_hash": "workspace-a"
      },
      "case_id": "cache-fallback",
      "interventions": {
        "matched-size-control": {
          "arm_id": "matched-size-control",
          "blocked_cardinality": 1,
          "blocked_source_groups": [
            "g-dist-a"
          ],
          "blocked_tokens": 12,
          "context_token_budget": 48,
          "intervention_sha256": "177de5f6ad44251353364e1b9aef30cc502582ae0baf357eafbc2986523a2cfa",
          "receipt_sha256": "6aa79f715f98fafb2f115562d7bae328c092dcd3998437faec6123f7c83fdf77",
          "scan_budget": 12
        },
        "random-control": {
          "arm_id": "random-control",
          "blocked_cardinality": 1,
          "blocked_source_groups": [
            "g-dist-c"
          ],
          "blocked_tokens": 12,
          "context_token_budget": 48,
          "intervention_sha256": "14fedca99991d9cd8f25d6cd114e29bf305b2194738e65e8561fdcb4874c0839",
          "receipt_sha256": "6aa79f715f98fafb2f115562d7bae328c092dcd3998437faec6123f7c83fdf77",
          "scan_budget": 12
        },
        "receipt-blocked": {
          "arm_id": "receipt-blocked",
          "blocked_cardinality": 1,
          "blocked_source_groups": [
            "g-cache"
          ],
          "blocked_tokens": 12,
          "context_token_budget": 48,
          "intervention_sha256": "ef8a1d0c65edec8d97970426352447630e67a71ff7525148d0875f6915e2ec8f",
          "receipt_sha256": "6aa79f715f98fafb2f115562d7bae328c092dcd3998437faec6123f7c83fdf77",
          "scan_budget": 12
        }
      },
      "query_sha256": "dddada5ae1bba2c305d2fff15bb442152acd45f5648321b4fb06410c969e8679"
    },
    {
      "baseline_receipt": {
        "agent_id": "agent-a",
        "as_of_unix_ms": 1787616000000,
        "baseline_selection_sha256": "db0a0cbe6b5537ec6ab14cc70e8d6c66a7be2ee53ef888c5c6a8d9f53439abe9",
        "case_id": "selected-unreceipted",
        "config_sha256": "835b662a6dd58282da6610f6a19c334951ecf1e3e818eb8b5aa12026c552e5f7",
        "receipt_candidate_ids": [
          "ev-primary"
        ],
        "receipt_sha256": "c01af3f10a10b431b8240d25d8aa48728ee8d8d37e3841edff63f291a3c41d63",
        "receipt_source_groups": [
          "g-primary"
        ],
        "receipt_source_refs": [
          "ref-primary"
        ],
        "schema_version": "perseus-vault-evidence-intervention-receipt/v1",
        "sealed_before_intervention": true,
        "workspace_hash": "workspace-a"
      },
      "case_id": "selected-unreceipted",
      "interventions": {
        "matched-size-control": {
          "arm_id": "matched-size-control",
          "blocked_cardinality": 1,
          "blocked_source_groups": [
            "g-dist-a"
          ],
          "blocked_tokens": 12,
          "context_token_budget": 48,
          "intervention_sha256": "aa22ff1f8483e6bacc590c136b32c32cf4a46e4d0a3c5c718686bf82fcef5c5c",
          "receipt_sha256": "c01af3f10a10b431b8240d25d8aa48728ee8d8d37e3841edff63f291a3c41d63",
          "scan_budget": 12
        },
        "random-control": {
          "arm_id": "random-control",
          "blocked_cardinality": 1,
          "blocked_source_groups": [
            "g-support"
          ],
          "blocked_tokens": 12,
          "context_token_budget": 48,
          "intervention_sha256": "bca81e728c78795bf52bb0a5e8d592752d743f6bc4f9ba02bf705d9355fb3a00",
          "receipt_sha256": "c01af3f10a10b431b8240d25d8aa48728ee8d8d37e3841edff63f291a3c41d63",
          "scan_budget": 12
        },
        "receipt-blocked": {
          "arm_id": "receipt-blocked",
          "blocked_cardinality": 1,
          "blocked_source_groups": [
            "g-primary"
          ],
          "blocked_tokens": 12,
          "context_token_budget": 48,
          "intervention_sha256": "44112dc6173b73d11990c87a6b0c20952724393644440f6f528ce5193cec06f9",
          "receipt_sha256": "c01af3f10a10b431b8240d25d8aa48728ee8d8d37e3841edff63f291a3c41d63",
          "scan_budget": 12
        }
      },
      "query_sha256": "a64cfe443f073d7fbb9ac18d8fe882d0fc30395e280614580908d8f62b67bb29"
    },
    {
      "baseline_receipt": {
        "agent_id": "agent-a",
        "as_of_unix_ms": 1787616000000,
        "baseline_selection_sha256": "475490f748a6a2b2d683ac3c7563313bb42695037103a9cd848021875a670e22",
        "case_id": "source-expansion",
        "config_sha256": "835b662a6dd58282da6610f6a19c334951ecf1e3e818eb8b5aa12026c552e5f7",
        "receipt_candidate_ids": [
          "ev-exp-base"
        ],
        "receipt_sha256": "4616f7ca78758b65a3069faae77da8b485152675cc597cceb76718faee863af8",
        "receipt_source_groups": [
          "g-exp"
        ],
        "receipt_source_refs": [
          "ref-exp-base"
        ],
        "schema_version": "perseus-vault-evidence-intervention-receipt/v1",
        "sealed_before_intervention": true,
        "workspace_hash": "workspace-a"
      },
      "case_id": "source-expansion",
      "interventions": {
        "matched-size-control": {
          "arm_id": "matched-size-control",
          "blocked_cardinality": 1,
          "blocked_source_groups": [